{
	"id": "PointOfInterest-Shop-1014",
	"type": "Shopping",
	"name": "ALBERT ARTS",
	"description": "MAJONE ....", 
	"address": {
		"addressCountry": "FR",
		"streetAddress": "5 Promenade des anglais"
	},
	"url" : "http://albert-arts.eu",
	"faxNumber" : "0 805 08 88 65",
	"telephone" : "+33(0)4 93 87 28 73",
	"email": "boutique@albert-arts.com",
	"paymentAccepted":["1", "2", "3"],
	"location": {
		"type": "Point",
		"coordinates": [
			-8.768460000000001, 
			42.60214472222222
			]
	},
	"proximity" : ["Bord de mer"],
	"category": ["4", "5", "6"],
	"sector": null,
	"living" : null,
	"tariffs" : null,
	"capacity" :null,
	"closures" : {
		"closureDay": "Dimanche",
		"closureSpan": "toute la journée"
	},
	"spaces" : null,
	"openingHours" : "11:00-19:30",
	"closing" : "24H",
	"source": "LinkOfTheSource",
	"dateCreated": "2015-07-21 15:30:03",
	"dateUpdated": "2017-08-30 17:31:02", 
	"refSeeAlso": ["Shop-NCA-2017"]
}